{
  "pack_id": "aip-reelcast-001",
  "version": "1.0.0",
  "sha256": "1111111111111111111111111111111111111111111111111111111111111111",
  "status": "RATIFIED",
  "shared_core": {
    "source_premise_refs": [{"object_id": "premise-001", "version": "1", "sha256": "2222222222222222222222222222222222222222222222222222222222222222", "authority": "source_product"}],
    "identity_dna_ref": {"object_id": "guest-dna-001", "version": "4", "sha256": "3333333333333333333333333333333333333333333333333333333333333333", "authority": "human_identity_authority"},
    "context_premise_ref": {"object_id": "context-001", "version": "2", "sha256": "4444444444444444444444444444444444444444444444444444444444444444", "authority": "audience_research"},
    "resonance_ref": {"object_id": "resonance-001", "version": "1", "sha256": "5555555555555555555555555555555555555555555555555555555555555555", "authority": "activation_compiler"},
    "matrix_of_edging_ref": {"object_id": "edge-001", "version": "3", "sha256": "6666666666666666666666666666666666666666666666666666666666666666", "authority": "activation_compiler"},
    "hidden_pressure": "truth softened to remain liked",
    "activation_directions": ["mirror", "target"],
    "roles": ["leader"],
    "stance": "truth_over_approval",
    "stakes": ["self_trust"],
    "identity_urges": ["say_the_honest_sentence"],
    "participation_design": "invite one source-backed example",
    "intended_reaction": "recall a sentence they softened",
    "smallest_useful_commitment": "name the sentence",
    "wrong_reading_locks": ["generic_confidence_advice"],
    "evaluation_contract_ref": {"object_id": "eval-001", "version": "1", "sha256": "7777777777777777777777777777777777777777777777777777777777777777", "authority": "evaluation_governance"}
  },
  "activative_call_seeds": ["What sentence did you soften to remain liked?"],
  "visual_branch_requirements": ["recognition carrier must preserve the leadership context"],
  "registry_refs": [{"object_id": "category-registry", "version": "1.2.0-aligned", "sha256": "8888888888888888888888888888888888888888888888888888888888888888", "authority": "builder_governance"}],
  "frozen_at": "2026-07-14T00:00:00Z"
}
